{
  "schema_version": 1,
  "generated_at": "<generated_at>",
  "first_trade_date": "2026-08-30",
  "discord_imported": true,
  "leagues": [
    {
      "league": "Fixture Premier",
      "season": 2026,
      "generated_at": "<generated_at>",
      "completed_weeks": [
        1,
        2
      ],
      "first_trade_date": "2026-08-30",
      "trades": [
        {
          "id": "1790182800000-2-4",
          "traded_at": "2026-09-23T17:00:00+00:00",
          "transaction_week": 3,
          "weeks": [],
          "trade_week": null,
          "sides": [
            {
              "team_id": 2,
              "team": "Boom Baum",
              "sent": [
                {
                  "id": 302,
                  "name": "WR Bravo"
                }
              ],
              "received": [
                {
                  "id": 304,
                  "name": "WR Delta",
                  "weeks": {}
                }
              ],
              "weekly_points": {},
              "total_points": null
            },
            {
              "team_id": 4,
              "team": "Cowboys",
              "sent": [
                {
                  "id": 304,
                  "name": "WR Delta"
                }
              ],
              "received": [
                {
                  "id": 302,
                  "name": "WR Bravo",
                  "weeks": {}
                }
              ],
              "weekly_points": {},
              "total_points": null
            }
          ],
          "receipts": []
        },
        {
          "id": "1789569900000-1-3",
          "traded_at": "2026-09-16T14:45:00+00:00",
          "transaction_week": 2,
          "weeks": [
            2
          ],
          "trade_week": 2,
          "sides": [
            {
              "team_id": 1,
              "team": "All Gold",
              "sent": [
                {
                  "id": 401,
                  "name": "Bench RB One"
                }
              ],
              "received": [
                {
                  "id": 404,
                  "name": "Bench RB Four",
                  "weeks": {
                    "2": 15.5
                  }
                }
              ],
              "weekly_points": {
                "2": 15.5
              },
              "total_points": 15.5
            },
            {
              "team_id": 3,
              "team": "Shiny Hineys",
              "sent": [
                {
                  "id": 404,
                  "name": "Bench RB Four"
                }
              ],
              "received": [
                {
                  "id": 401,
                  "name": "Bench RB One",
                  "weeks": {
                    "2": 12.5
                  }
                }
              ],
              "weekly_points": {
                "2": 12.5
              },
              "total_points": 12.5
            }
          ],
          "receipts": [
            {
              "channel": "trade-talk",
              "author": "commish",
              "content": "Bench RB Four is on the move again",
              "sent_at": "2026-09-16T15:30:00+00:00",
              "url": "https://discord.com/channels/1160416084235661426/1160416085326188557/9001"
            }
          ]
        },
        {
          "id": "1789520700000-3-4",
          "traded_at": "2026-09-16T01:05:00+00:00",
          "transaction_week": 2,
          "weeks": [
            2
          ],
          "trade_week": 2,
          "sides": [
            {
              "team_id": 3,
              "team": "Shiny Hineys",
              "sent": [
                {
                  "id": 303,
                  "name": "WR Charlie"
                }
              ],
              "received": [
                {
                  "id": 404,
                  "name": "Bench RB Four",
                  "weeks": {
                    "2": 15.5
                  }
                }
              ],
              "weekly_points": {
                "2": 15.5
              },
              "total_points": 15.5
            },
            {
              "team_id": 4,
              "team": "Cowboys",
              "sent": [
                {
                  "id": 404,
                  "name": "Bench RB Four"
                }
              ],
              "received": [
                {
                  "id": 303,
                  "name": "WR Charlie",
                  "weeks": {
                    "2": 24.0
                  }
                }
              ],
              "weekly_points": {
                "2": 24.0
              },
              "total_points": 24.0
            }
          ],
          "receipts": [
            {
              "channel": "trade-talk",
              "author": "commish",
              "content": "Bench RB Four is on the move again",
              "sent_at": "2026-09-16T15:30:00+00:00",
              "url": "https://discord.com/channels/1160416084235661426/1160416085326188557/9001"
            }
          ]
        },
        {
          "id": "1788395400000-1-2",
          "traded_at": "2026-09-03T00:30:00+00:00",
          "transaction_week": 1,
          "weeks": [
            1,
            2
          ],
          "trade_week": null,
          "sides": [
            {
              "team_id": 1,
              "team": "All Gold",
              "sent": [
                {
                  "id": 301,
                  "name": "WR Alpha"
                }
              ],
              "received": [
                {
                  "id": 202,
                  "name": "RB Bravo",
                  "weeks": {
                    "1": 17.3,
                    "2": 6.1
                  }
                }
              ],
              "weekly_points": {
                "1": 17.3,
                "2": 6.1
              },
              "total_points": 23.4
            },
            {
              "team_id": 2,
              "team": "Boom Baum",
              "sent": [
                {
                  "id": 202,
                  "name": "RB Bravo"
                }
              ],
              "received": [
                {
                  "id": 301,
                  "name": "WR Alpha",
                  "weeks": {
                    "1": 19.9,
                    "2": 3.2
                  }
                }
              ],
              "weekly_points": {
                "1": 19.9,
                "2": 3.2
              },
              "total_points": 23.1
            }
          ],
          "receipts": []
        }
      ],
      "alternate_standings": {
        "weeks": [
          {
            "week": 1,
            "rewound_players": 2,
            "lineups": [
              {
                "team_id": 1,
                "team": "All Gold",
                "actual_points": 58.4,
                "optimal_points": 58.4,
                "points_left": 0.0,
                "top_bench": {
                  "id": 401,
                  "name": "Bench RB One",
                  "points": 4.0
                }
              },
              {
                "team_id": 2,
                "team": "Boom Baum",
                "actual_points": 48.6,
                "optimal_points": 48.6,
                "points_left": 0.0,
                "top_bench": {
                  "id": 402,
                  "name": "Bench WR Two",
                  "points": 6.6
                }
              },
              {
                "team_id": 3,
                "team": "Shiny Hineys",
                "actual_points": 53.3,
                "optimal_points": 53.3,
                "points_left": 0.0,
                "top_bench": null
              },
              {
                "team_id": 4,
                "team": "Cowboys",
                "actual_points": 40.8,
                "optimal_points": 40.8,
                "points_left": 0.0,
                "top_bench": null
              }
            ],
            "matchups": [
              {
                "home_team_id": 1,
                "away_team_id": 2,
                "home_score": 58.4,
                "away_score": 48.6
              },
              {
                "home_team_id": 3,
                "away_team_id": 4,
                "home_score": 53.3,
                "away_score": 40.8
              }
            ]
          },
          {
            "week": 2,
            "rewound_players": 5,
            "lineups": [
              {
                "team_id": 1,
                "team": "All Gold",
                "actual_points": 43.2,
                "optimal_points": 51.1,
                "points_left": 7.9,
                "top_bench": {
                  "id": 201,
                  "name": "RB Alpha",
                  "points": 14.0
                }
              },
              {
                "team_id": 2,
                "team": "Boom Baum",
                "actual_points": 52.7,
                "optimal_points": 60.6,
                "points_left": 7.9,
                "top_bench": {
                  "id": 499,
                  "name": "Waiver WR",
                  "points": 11.1
                }
              },
              {
                "team_id": 3,
                "team": "Shiny Hineys",
                "actual_points": 44.2,
                "optimal_points": 44.2,
                "points_left": 0.0,
                "top_bench": null
              },
              {
                "team_id": 4,
                "team": "Cowboys",
                "actual_points": 75.7,
                "optimal_points": 75.7,
                "points_left": 0.0,
                "top_bench": null
              }
            ],
            "matchups": [
              {
                "home_team_id": 1,
                "away_team_id": 3,
                "home_score": 43.2,
                "away_score": 44.2
              },